<!ELEMENT protocol (msg_class+)>
<!ATTLIST protocol>

<!ELEMENT msg_class (message+)>
<!ATTLIST msg_class
  name CDATA #REQUIRED
  id   CDATA #IMPLIED
>

<!ELEMENT message (description?,field*)>
<!ATTLIST message
  name CDATA #REQUIRED
  id   CDATA #REQUIRED
  link CDATA #IMPLIED
  radio_retry (true|false|1|0) #IMPLIED
>

<!ELEMENT description (#PCDATA)>

<!ELEMENT field (#PCDATA)>
<!ATTLIST field
  name CDATA #REQUIRED
  type CDATA #REQUIRED
  format CDATA #IMPLIED
  unit CDATA #IMPLIED
  values CDATA #IMPLIED
  alt_unit CDATA #IMPLIED
  alt_unit_coef CDATA #IMPLIED
>

